{
  "schema_version": "1.0.0",
  "run_id": "demo-run",
  "attempt_id": "attempt-01",
  "invocation_id": "11111111-1111-4111-8111-111111111111",
  "parent_invocation_id": null,
  "agent_name": "kp_explorer",
  "role": "explorer",
  "harness": "codex",
  "status": "completed",
  "source_snapshot_sha256": "0000000000000000000000000000000000000000000000000000000000000000",
  "scope": {
    "read": [
      "src/auth/**"
    ],
    "write": []
  },
  "summary": "Mapped the auth refresh path.",
  "claims": [
    {
      "claim_id": "path-map",
      "statement": "Refresh requests pass through refresh_session().",
      "evidence_refs": [
        "src/auth/session.py:refresh_session"
      ],
      "producer_state": "asserted"
    }
  ],
  "artifact_refs": [],
  "command_refs": [],
  "blockers": [],
  "residual_risks": [
    "Runtime behavior was not observed."
  ],
  "origin": "self-reported"
}
